{
  "event_id": "01938a4f-8c2a-7c8e-9a4b-3e6f5d4b2c1a",
  "timestamp": "2026-09-15T10:23:04Z",
  "kind": "student.record.read",
  "source": "vendory-tutorai-3.4",
  "subject_student_ref": {
    "scheme": "state-student-id-tokenized",
    "value": "tok-IL-1700420-X9JK4M2P"
  },
  "resource": {
    "type": "sis-record",
    "ceds_element_id": "000234",
    "ed_fi_resource_kind": "StudentGradebookEntry",
    "id_tokenized": "tok-sis-springfield-2026q3-7B3F",
    "fields_accessed": [
      "grade-letter",
      "trend-last-30-days"
    ]
  },
  "action": "R",
  "outcome": "0",
  "agent": {
    "ai_tool_card_url": "https://vendory.example/.well-known/agents/tutorai-3.4.json",
    "ai_decision_card_url": "https://springfield.k12.example/.well-known/decisions/SPRINGFIELD-DEC-2026-EDTECH-0014.json",
    "principal": "tutor-bot-grade-6-math-period-3"
  },
  "consent_basis": {
    "code": "ferpa-school-official",
    "citation": "34 CFR §99.31(a)(1)(i)(B)"
  },
  "decision_card_ref": "https://springfield.k12.example/.well-known/decisions/SPRINGFIELD-DEC-2026-EDTECH-0014.json",
  "records_of_disclosure_status": {
    "logged_in_99_32": false,
    "carveout_reason": "school-official-exception per §99.32(d)(2) — VendorY TutorAI under direct LEA control via SOPPA addendum"
  },
  "purpose_of_use": "Personalized tutoring next-problem generation",
  "redaction_applied": [
    "student.name.first",
    "student.name.last",
    "student.state_id"
  ],
  "network": {
    "source_ip_hashed": "h2:7f3a1b9c8d4e5f6a",
    "tls_version": "1.3"
  },
  "signature": {
    "algorithm": "ed25519",
    "signer_key_uri": "https://vendory.example/.well-known/keys/student-data-access-signer.json#k-2026q3",
    "signature_b64": "ILLUSTRATIVE_PLACEHOLDER_SIGNATURE_FOR_SCHEMA_DOCUMENTATION"
  },
  "prev_hash": "0000000000000000000000000000000000000000000000000000000000000000",
  "hash": "75825c19d4d1b66388e4fc65ef423f69d1360d22a282683b94db8f1bff008c2e"
}
